{
  "schema": "rust-project-collector-binding/v1",
  "input": {
    "schema": "harness-project-collector-request/v1",
    "project": "native-test",
    "collector": {
      "name": "harness-gate-rust-collector",
      "version": "0.1.0-rc.1"
    },
    "context": {
      "target": "native",
      "run": "project-test",
      "commit": "aaaaaaaaaaaaaaaaaaaaaaaaaaaaaaaaaaaaaaaa",
      "base_commit": "bbbbbbbbbbbbbbbbbbbbbbbbbbbbbbbbbbbbbbbb"
    },
    "workspace_root": "/mnt/dev-ssd/workspaces/symphony/GH-231/target/gh-231/runtime-tests/tmp_k4g84ws/base",
    "output_root": "/mnt/dev-ssd/workspaces/symphony/GH-231/target/gh-231/rc-binding-output",
    "selection": {},
    "bindings": [
      {
        "subject": "subject-identity/v1:9fe76a240822d2ba336111212f4046a21d9ebc6e328a7fbf86f7435ef80ac761",
        "capability": "complexity.cyclomatic",
        "series": "measurement-series/v1:b4e74adeca90a1d3f2f0eb0d69985fa69ef33dfad5dd0a13c7ec6f3f3dd1a0ce"
      },
      {
        "subject": "subject-identity/v1:9fe76a240822d2ba336111212f4046a21d9ebc6e328a7fbf86f7435ef80ac761",
        "capability": "coverage.function",
        "series": "measurement-series/v1:b4e74adeca90a1d3f2f0eb0d69985fa69ef33dfad5dd0a13c7ec6f3f3dd1a0ce"
      },
      {
        "subject": "subject-identity/v1:9fe76a240822d2ba336111212f4046a21d9ebc6e328a7fbf86f7435ef80ac761",
        "capability": "coverage.line",
        "series": "measurement-series/v1:b4e74adeca90a1d3f2f0eb0d69985fa69ef33dfad5dd0a13c7ec6f3f3dd1a0ce"
      },
      {
        "subject": "subject-identity/v1:9fe76a240822d2ba336111212f4046a21d9ebc6e328a7fbf86f7435ef80ac761",
        "capability": "coverage.region",
        "series": "measurement-series/v1:b4e74adeca90a1d3f2f0eb0d69985fa69ef33dfad5dd0a13c7ec6f3f3dd1a0ce"
      },
      {
        "subject": "subject-identity/v1:9fe76a240822d2ba336111212f4046a21d9ebc6e328a7fbf86f7435ef80ac761",
        "capability": "risk.crap",
        "series": "measurement-series/v1:b4e74adeca90a1d3f2f0eb0d69985fa69ef33dfad5dd0a13c7ec6f3f3dd1a0ce"
      },
      {
        "subject": "subject-identity/v1:10f96f90558fd282e3227ad544bcd882e3e0786ba46343198e387da0d35546a4",
        "capability": "complexity.cyclomatic",
        "series": "measurement-series/v1:b4e74adeca90a1d3f2f0eb0d69985fa69ef33dfad5dd0a13c7ec6f3f3dd1a0ce"
      },
      {
        "subject": "subject-identity/v1:10f96f90558fd282e3227ad544bcd882e3e0786ba46343198e387da0d35546a4",
        "capability": "coverage.function",
        "series": "measurement-series/v1:b4e74adeca90a1d3f2f0eb0d69985fa69ef33dfad5dd0a13c7ec6f3f3dd1a0ce"
      },
      {
        "subject": "subject-identity/v1:10f96f90558fd282e3227ad544bcd882e3e0786ba46343198e387da0d35546a4",
        "capability": "coverage.line",
        "series": "measurement-series/v1:b4e74adeca90a1d3f2f0eb0d69985fa69ef33dfad5dd0a13c7ec6f3f3dd1a0ce"
      },
      {
        "subject": "subject-identity/v1:10f96f90558fd282e3227ad544bcd882e3e0786ba46343198e387da0d35546a4",
        "capability": "coverage.region",
        "series": "measurement-series/v1:b4e74adeca90a1d3f2f0eb0d69985fa69ef33dfad5dd0a13c7ec6f3f3dd1a0ce"
      },
      {
        "subject": "subject-identity/v1:10f96f90558fd282e3227ad544bcd882e3e0786ba46343198e387da0d35546a4",
        "capability": "risk.crap",
        "series": "measurement-series/v1:b4e74adeca90a1d3f2f0eb0d69985fa69ef33dfad5dd0a13c7ec6f3f3dd1a0ce"
      },
      {
        "subject": "subject-identity/v1:62d4c7b533d6f4a466c79028f2f249368e6647e87bceb585aa48c833ae06b376",
        "capability": "complexity.cyclomatic",
        "series": "measurement-series/v1:b4e74adeca90a1d3f2f0eb0d69985fa69ef33dfad5dd0a13c7ec6f3f3dd1a0ce"
      },
      {
        "subject": "subject-identity/v1:62d4c7b533d6f4a466c79028f2f249368e6647e87bceb585aa48c833ae06b376",
        "capability": "coverage.function",
        "series": "measurement-series/v1:b4e74adeca90a1d3f2f0eb0d69985fa69ef33dfad5dd0a13c7ec6f3f3dd1a0ce"
      },
      {
        "subject": "subject-identity/v1:62d4c7b533d6f4a466c79028f2f249368e6647e87bceb585aa48c833ae06b376",
        "capability": "coverage.line",
        "series": "measurement-series/v1:b4e74adeca90a1d3f2f0eb0d69985fa69ef33dfad5dd0a13c7ec6f3f3dd1a0ce"
      },
      {
        "subject": "subject-identity/v1:62d4c7b533d6f4a466c79028f2f249368e6647e87bceb585aa48c833ae06b376",
        "capability": "coverage.region",
        "series": "measurement-series/v1:b4e74adeca90a1d3f2f0eb0d69985fa69ef33dfad5dd0a13c7ec6f3f3dd1a0ce"
      },
      {
        "subject": "subject-identity/v1:62d4c7b533d6f4a466c79028f2f249368e6647e87bceb585aa48c833ae06b376",
        "capability": "risk.crap",
        "series": "measurement-series/v1:b4e74adeca90a1d3f2f0eb0d69985fa69ef33dfad5dd0a13c7ec6f3f3dd1a0ce"
      },
      {
        "subject": "subject-identity/v1:adb497673c471140eb073b4d134bc603db33aa8844fa4bd0ae6a3ff4686d8a7b",
        "capability": "complexity.cyclomatic",
        "series": "measurement-series/v1:b4e74adeca90a1d3f2f0eb0d69985fa69ef33dfad5dd0a13c7ec6f3f3dd1a0ce"
      },
      {
        "subject": "subject-identity/v1:adb497673c471140eb073b4d134bc603db33aa8844fa4bd0ae6a3ff4686d8a7b",
        "capability": "coverage.function",
        "series": "measurement-series/v1:b4e74adeca90a1d3f2f0eb0d69985fa69ef33dfad5dd0a13c7ec6f3f3dd1a0ce"
      },
      {
        "subject": "subject-identity/v1:adb497673c471140eb073b4d134bc603db33aa8844fa4bd0ae6a3ff4686d8a7b",
        "capability": "coverage.line",
        "series": "measurement-series/v1:b4e74adeca90a1d3f2f0eb0d69985fa69ef33dfad5dd0a13c7ec6f3f3dd1a0ce"
      },
      {
        "subject": "subject-identity/v1:adb497673c471140eb073b4d134bc603db33aa8844fa4bd0ae6a3ff4686d8a7b",
        "capability": "coverage.region",
        "series": "measurement-series/v1:b4e74adeca90a1d3f2f0eb0d69985fa69ef33dfad5dd0a13c7ec6f3f3dd1a0ce"
      },
      {
        "subject": "subject-identity/v1:adb497673c471140eb073b4d134bc603db33aa8844fa4bd0ae6a3ff4686d8a7b",
        "capability": "risk.crap",
        "series": "measurement-series/v1:b4e74adeca90a1d3f2f0eb0d69985fa69ef33dfad5dd0a13c7ec6f3f3dd1a0ce"
      },
      {
        "subject": "subject-identity/v1:988cdb96bc8b4acbca2b1a9da4e1d74677de9970a4b67e67a665440a3876e7f5",
        "capability": "complexity.cyclomatic",
        "series": "measurement-series/v1:b4e74adeca90a1d3f2f0eb0d69985fa69ef33dfad5dd0a13c7ec6f3f3dd1a0ce"
      },
      {
        "subject": "subject-identity/v1:988cdb96bc8b4acbca2b1a9da4e1d74677de9970a4b67e67a665440a3876e7f5",
        "capability": "coverage.function",
        "series": "measurement-series/v1:b4e74adeca90a1d3f2f0eb0d69985fa69ef33dfad5dd0a13c7ec6f3f3dd1a0ce"
      },
      {
        "subject": "subject-identity/v1:988cdb96bc8b4acbca2b1a9da4e1d74677de9970a4b67e67a665440a3876e7f5",
        "capability": "coverage.line",
        "series": "measurement-series/v1:b4e74adeca90a1d3f2f0eb0d69985fa69ef33dfad5dd0a13c7ec6f3f3dd1a0ce"
      },
      {
        "subject": "subject-identity/v1:988cdb96bc8b4acbca2b1a9da4e1d74677de9970a4b67e67a665440a3876e7f5",
        "capability": "coverage.region",
        "series": "measurement-series/v1:b4e74adeca90a1d3f2f0eb0d69985fa69ef33dfad5dd0a13c7ec6f3f3dd1a0ce"
      },
      {
        "subject": "subject-identity/v1:988cdb96bc8b4acbca2b1a9da4e1d74677de9970a4b67e67a665440a3876e7f5",
        "capability": "risk.crap",
        "series": "measurement-series/v1:b4e74adeca90a1d3f2f0eb0d69985fa69ef33dfad5dd0a13c7ec6f3f3dd1a0ce"
      },
      {
        "subject": "subject-identity/v1:090f4af9de12691e84e1ef8026738224282fde0a3a0b2afdc5cd8dbb9a3f0c07",
        "capability": "complexity.cyclomatic",
        "series": "measurement-series/v1:b4e74adeca90a1d3f2f0eb0d69985fa69ef33dfad5dd0a13c7ec6f3f3dd1a0ce"
      },
      {
        "subject": "subject-identity/v1:090f4af9de12691e84e1ef8026738224282fde0a3a0b2afdc5cd8dbb9a3f0c07",
        "capability": "coverage.function",
        "series": "measurement-series/v1:b4e74adeca90a1d3f2f0eb0d69985fa69ef33dfad5dd0a13c7ec6f3f3dd1a0ce"
      },
      {
        "subject": "subject-identity/v1:090f4af9de12691e84e1ef8026738224282fde0a3a0b2afdc5cd8dbb9a3f0c07",
        "capability": "coverage.line",
        "series": "measurement-series/v1:b4e74adeca90a1d3f2f0eb0d69985fa69ef33dfad5dd0a13c7ec6f3f3dd1a0ce"
      },
      {
        "subject": "subject-identity/v1:090f4af9de12691e84e1ef8026738224282fde0a3a0b2afdc5cd8dbb9a3f0c07",
        "capability": "coverage.region",
        "series": "measurement-series/v1:b4e74adeca90a1d3f2f0eb0d69985fa69ef33dfad5dd0a13c7ec6f3f3dd1a0ce"
      },
      {
        "subject": "subject-identity/v1:090f4af9de12691e84e1ef8026738224282fde0a3a0b2afdc5cd8dbb9a3f0c07",
        "capability": "risk.crap",
        "series": "measurement-series/v1:b4e74adeca90a1d3f2f0eb0d69985fa69ef33dfad5dd0a13c7ec6f3f3dd1a0ce"
      },
      {
        "subject": "subject-identity/v1:36230ed472ba900358bdad9e66722d8d6436ff98c987c0c16901e5c02446029a",
        "capability": "complexity.cyclomatic",
        "series": "measurement-series/v1:b4e74adeca90a1d3f2f0eb0d69985fa69ef33dfad5dd0a13c7ec6f3f3dd1a0ce"
      },
      {
        "subject": "subject-identity/v1:36230ed472ba900358bdad9e66722d8d6436ff98c987c0c16901e5c02446029a",
        "capability": "coverage.function",
        "series": "measurement-series/v1:b4e74adeca90a1d3f2f0eb0d69985fa69ef33dfad5dd0a13c7ec6f3f3dd1a0ce"
      },
      {
        "subject": "subject-identity/v1:36230ed472ba900358bdad9e66722d8d6436ff98c987c0c16901e5c02446029a",
        "capability": "coverage.line",
        "series": "measurement-series/v1:b4e74adeca90a1d3f2f0eb0d69985fa69ef33dfad5dd0a13c7ec6f3f3dd1a0ce"
      },
      {
        "subject": "subject-identity/v1:36230ed472ba900358bdad9e66722d8d6436ff98c987c0c16901e5c02446029a",
        "capability": "coverage.region",
        "series": "measurement-series/v1:b4e74adeca90a1d3f2f0eb0d69985fa69ef33dfad5dd0a13c7ec6f3f3dd1a0ce"
      },
      {